"id","slug","title","description","content","image_path","created_at","updated_at","user_id"
"1","fossil-fashion-how-some-dinosaurs-sported-feathers-before-birds-2","Fossil Fashion: How Some Dinosaurs Sported Feathers Before Birds","Dive into the fascinating world of paleo-fashion as we explore how some dinosaurs rocked feathers long before birds took to the skies. From the iconic Archaeopteryx to the fearsome Tyrannosaurus Rex, discover the diverse array of feathered dinosaurs and unravel the mysteries behind their stylish adornments. Join us on a journey through time as we uncover the evolution of fossil fashion and its implications for our understanding of prehistoric life.","In the world of paleontology, fashion isn't just about what's trendy; it's about uncovering the fascinating ways in which ancient creatures adorned themselves. While feathers might seem like a trait exclusive to modern birds, recent discoveries have revealed that some dinosaurs were actually rocking these stylish accessories long before our avian friends took flight.


Feathered dinosaurs first captured the imagination of scientists and enthusiasts alike with the discovery of fossils bearing unmistakable traces of feather-like structures. One such example is the famous Archaeopteryx, often hailed as the link between dinosaurs and birds. This remarkable creature, which lived around 150 million years ago, boasted feathers that were remarkably similar to those of today's birds, suggesting a close evolutionary relationship.

But Archaeopteryx wasn't alone in its fashion sense. Over the years, paleontologists have unearthed evidence of feathers in a variety of dinosaur species, ranging from the tiny, chicken-sized Microraptor to the massive, lumbering Tyrannosaurus Rex. These discoveries have challenged our preconceptions about dinosaurs as scaly, reptilian creatures and have painted a picture of a diverse and dynamic group of animals.


So why did these dinosaurs sport feathers? While the exact reasons remain the subject of scientific debate, researchers believe that feathers may have served a variety of purposes. In some cases, they may have provided insulation to help dinosaurs regulate their body temperature. In others, they may have been used for display, helping individuals attract mates or intimidate rivals. And in still others, they may have even played a role in flight, allowing certain dinosaurs to glide or maneuver through the air with ease.


Whatever their purpose, there's no denying the allure of these ancient fashion statements. From delicate downy feathers to elaborate plumage, the world of fossil fashion offers a glimpse into the rich diversity of life that once roamed our planet. And as scientists continue to uncover new evidence and unravel the mysteries of feathered dinosaurs, one thing is for certain: the story of fossil fashion is far from over.","65f1e1dda620a-.jpg","2024-03-13 17:26:53","2024-03-13 17:27:24","1"
"2","the-bizarre-beauty-of-the-deinocheirus-a-dino-with-gigantic-arms-and-no-claws","The Bizarre Beauty of the Deinocheirus: A Dino with Gigantic Arms and No Claws","Delve into the enigmatic world of the Deinocheirus, a dinosaur that defies expectations with its massive arms and clawless hands. Explore the peculiarities of this prehistoric giant and uncover the mysteries surrounding its unique anatomy. From its towering stature to its bewildering lack of claws, join us as we unravel the bizarre beauty of the Deinocheirus and shed light on one of the most intriguing creatures of the Mesozoic Era.","In the captivating world of paleontology, some discoveries defy expectations and challenge our understanding of prehistoric creatures. One such enigmatic dinosaur is the Deinocheirus, a colossal beast known for its massive arms and peculiar lack of claws. Join us as we delve into the strange beauty of this fascinating creature and unravel the mysteries behind its unique anatomy.

The Deinocheirus, meaning ""terrible hand,"" was first discovered in Mongolia in the 1960s. However, it wasn't until recently that paleontologists unearthed more complete specimens, shedding light on this puzzling dinosaur. Measuring up to 11 meters in length and weighing over six tons, the Deinocheirus is one of the largest known theropods, belonging to a group of carnivorous dinosaurs that includes the famous Tyrannosaurus Rex.

What sets the Deinocheirus apart from its relatives is its truly bizarre arms. Unlike other theropods, which typically had sharp claws for grasping and hunting, the Deinocheirus had long, slender arms that stretched over two meters in length – the largest of any dinosaur. Even more perplexing is the fact that these arms were clawless, resembling more closely the limbs of a modern-day ostrich than those of a fearsome predator.

So, what was the purpose of these gigantic arms? While the exact function remains a subject of debate among paleontologists, several intriguing theories have emerged. Some suggest that the Deinocheirus used its arms for gathering food, perhaps sifting through vegetation or scavenging carcasses. Others propose that these arms played a role in display or communication, helping individuals attract mates or establish dominance within their social groups.

Despite the many mysteries that surround it, the Deinocheirus serves as a striking reminder of the incredible diversity of life that once inhabited our planet. Its peculiar anatomy challenges our notions of what a dinosaur should look like and invites us to ponder the complexities of evolution. As scientists continue to study this remarkable creature, one thing is for certain: the beauty of the Deinocheirus lies not only in its size and strength but also in its ability to intrigue and captivate us with its enigmatic features.","65f1e27b62c08-.jpg","2024-03-13 17:29:31","2024-03-13 17:29:31","1"
"3","the-mystery-of-the-duck-billed-dinosaur-how-the-parasaurolophus-used-its-crest","The Mystery of the Duck-Billed Dinosaur: How the Parasaurolophus Used Its Crest","Unravel the captivating mystery of the Parasaurolophus and its iconic crest in this intriguing post. Discover the fascinating theories and research surrounding how this duck-billed dinosaur utilized its distinctive feature. From communication to thermoregulation, delve into the various hypotheses proposed by scientists as we seek to understand the true purpose behind the Parasaurolophus' enigmatic crest. Join us on a journey of scientific exploration as we delve into the secrets of one of the most beloved dinosaurs of the Cretaceous period","In the enthralling world of paleontology, mysteries abound, and few creatures embody this intrigue more than the Parasaurolophus. With its distinctively duck-billed profile and an impressive crest adorning its skull, this dinosaur has long captured the imagination of scientists and enthusiasts alike. But what was the purpose of this elaborate feature? Join us as we embark on a journey to unravel the enigma of the Parasaurolophus and explore the fascinating theories surrounding its iconic crest.

The Parasaurolophus, meaning ""near crested lizard,"" lived during the Late Cretaceous period, approximately 76 to 73 million years ago. One of the most striking features of this dinosaur is its elaborate cranial crest, which extended backward from its skull and could reach lengths of up to six feet in some species. Made of hollow tubes that were connected to the dinosaur's nasal passages, the crest is believed to have played a crucial role in communication.

One prevailing theory suggests that the Parasaurolophus used its crest to produce distinctive sounds, possibly for communication within its herd or to attract mates. By forcing air through the tubes in its crest, the dinosaur may have been able to create low-frequency calls that could travel over long distances, allowing individuals to communicate effectively in their dense forest habitats.

Another hypothesis proposes that the crest may have served as a visual display during courtship rituals or territorial disputes. Its elaborate shape and size could have made the Parasaurolophus appear larger and more formidable to rivals, helping individuals establish dominance or attract potential mates.

Additionally, researchers have suggested that the crest may have played a role in thermoregulation, helping the Parasaurolophus regulate its body temperature by dissipating excess heat or conserving warmth, much like the radiator in a car.

While the exact function of the Parasaurolophus' crest remains a topic of scientific debate, one thing is clear: this extraordinary feature played a significant role in the dinosaur's life. As we continue to uncover new evidence and refine our understanding of this remarkable creature, the mystery of the duck-billed dinosaur and its iconic crest only deepens, reminding us of the endless wonders waiting to be discovered in the fossil record. Join us on this captivating journey of scientific exploration as we unravel the secrets of the Parasaurolophus and shed light on one of the most intriguing chapters in the history of life on Earth.","65f1e2c6c9b7d-.jpg","2024-03-13 17:30:46","2024-03-13 17:30:46","1"
"4","jurassic-jaws-unraveling-the-enigma-of-the-helicoprion-s-spiral-teeth","Jurassic Jaws: Unraveling the Enigma of the Helicoprion's Spiral Teeth","Dive into the depths of prehistoric oceans with 'Jurassic Jaws', where we embark on a thrilling quest to unravel the mysteries of the Helicoprion's spiral teeth. Join us as we journey back millions of years to explore the bizarre world of this ancient shark-like creature and its unique dental adaptation. From scientific speculation to cutting-edge research, follow along as we uncover the secrets behind the Helicoprion's enigmatic tooth whirls and delve into the evolutionary significance of this fascinating fossil find. Get ready for a jaw-dropping adventure through time and science!","In the vast oceans of the prehistoric world, mysteries lurk beneath the waves, waiting to be uncovered. Among these enigmatic creatures is the Helicoprion, a marine predator unlike any other. Its claim to fame? A peculiar dental arrangement featuring spiral teeth, which have baffled scientists for centuries. In this expedition into the depths of paleontology, we embark on a thrilling journey to unravel the secrets of the Helicoprion's jaw-dropping spiral teeth.

The Helicoprion's teeth are truly a marvel of evolution, resembling tightly wound coils that spiral out from its lower jaw. For years, paleontologists puzzled over how these teeth fit together and functioned within the creature's mouth. Were they used for crushing shellfish? Grasping prey? Or perhaps even slicing through flesh with surgical precision?

Recent advances in technology and paleontological research have shed new light on this ancient mystery. Through detailed examination of fossilized specimens and sophisticated computer modeling, scientists have pieced together the puzzle of the Helicoprion's jaws. It turns out that the spiral teeth were not arranged in a circular saw-like structure, as previously believed, but rather formed a single, continuous whorl within the creature's lower jaw.

But how did the Helicoprion use these spiral teeth to hunt and feed? While the exact feeding behavior remains speculative, scientists propose that the Helicoprion likely employed a unique slicing motion to capture and consume its prey. By rotating its lower jaw in a circular motion, the Helicoprion could have slashed through the flesh of its victims, much like a modern-day circular saw.

Yet, the mystery of the Helicoprion's spiral teeth is far from solved. Despite significant advancements in our understanding of this ancient predator, many questions remain unanswered. What drove the evolution of such a specialized dental adaptation? How did the Helicoprion fit into the complex web of prehistoric marine ecosystems?

As we continue to uncover the secrets of the past, the story of the Helicoprion serves as a reminder of the wonders that lie buried beneath the surface of our planet. Join us on this voyage of discovery as we unravel the enigma of Jurassic Jaws and delve into the fascinating world of ancient marine predators.","65f1e31dd2b43-.jpg","2024-03-13 17:32:13","2024-03-13 17:32:13","1"
"5","nanuqsaurus-the-polar-predator-of-the-cretaceous","Nanuqsaurus: The Polar Predator of the Cretaceous","Step into the icy realms of the Cretaceous period as we unearth the secrets of Nanuqsaurus, the enigmatic polar predator. Join us on a journey through time and space to the ancient Arctic, where this diminutive cousin of T. rex once roamed. Discover the latest research and theories surrounding this fascinating dinosaur, from its adaptation to polar climates to its potential role in the prehistoric ecosystem. Get ready to brave the frozen tundra and uncover the mysteries of Nanuqsaurus in this thrilling expedition into the past.","In the frosty landscape of the ancient Arctic, a fearsome predator lurked, wielding its dominance in a world of ice and snow. Meet Nanuqsaurus, the polar predator of the Cretaceous period, whose story is as chilling as the environment it once inhabited.

Discovered in the rugged terrains of Alaska's North Slope, Nanuqsaurus is a relatively recent addition to the pantheon of dinosaur discoveries. Named after the Inupiat word for ""polar bear lizard,"" this small but mighty carnivore is believed to have roamed the polar regions approximately 70 million years ago.

Despite its diminutive size compared to its famous cousin, Tyrannosaurus rex, Nanuqsaurus was no less formidable. With its powerful jaws and serrated teeth, it was well-equipped to hunt and thrive in the harsh conditions of the ancient Arctic. But what sets Nanuqsaurus apart from its larger relatives is its ability to adapt to polar climates—a trait that sets it apart as a truly unique predator.

While much about Nanuqsaurus remains shrouded in mystery, paleontologists have pieced together clues about its lifestyle and behavior through careful analysis of its fossils. Its smaller size suggests that it may have been more agile and better suited to hunting smaller prey than its larger relatives. Additionally, its presence in the polar regions hints at a fascinating adaptation to extreme environments—a feat that few dinosaurs could match.

But perhaps the most intriguing aspect of Nanuqsaurus is its role within the ancient Arctic ecosystem. As one of the top predators of its time, Nanuqsaurus would have played a crucial role in regulating the population of herbivorous dinosaurs and shaping the dynamics of its prehistoric habitat.

As our understanding of Nanuqsaurus continues to evolve, so too does our appreciation for the diversity and resilience of life in Earth's distant past. Through the study of this polar predator, we gain valuable insights into the complex interplay between dinosaurs and their environments—a story that continues to captivate and inspire us to this day.

Join us as we journey back in time to uncover the mysteries of Nanuqsaurus, the polar predator of the Cretaceous, and explore the untamed wilderness of the ancient Arctic in search of clues to its enigmatic existence.","65f1e36ee0bc8-.jpg","2024-03-13 17:33:34","2024-03-13 17:33:34","1"
